published_date,topic,source,region,title,url,full_text
11-03-26,Russia Ukraine war,Euronews,Europe,Find all the latest news about Ukraine | euronews,https://www.euronews.com/news/europe/ukraine,"The Cube Fact check: Has Ukraine just legalised same-sex marriage? A Supreme Court ruling in Ukraine recognising a same-sex couple as a ""de facto"" family unit has sparked confusion online. 11/03/2026
Ukraine Russia and Ukraine make rival claims on status of front line progress US-brokered ceasefire talks between Russia and Ukraine were put on hold due to the growing escalation in the Middle East, which has drawn attention away from Europe’s biggest conflict since World War II. 10/03/2026
Ukraine Ukraine seeks return of money and valuables seized in Hungary Kyiv is seeking help from the EU to recover money and valuables seized by Hungary last week, while Hungarian Prime Minister Viktor Orban ordered the government to hold cash and gold seized from a Ukrainian bank for up to 60 days amid an ongoing investigation. 10/03/2026
Ukraine Eleven countries ask Ukraine for help with Iran's drone warfare Kyiv is reviewing official requests from countries neighbouring Iran, as well as from the US and European countries, which are now asking Ukraine for help with anti-drone air defence. 09/03/2026
Europe News Russia fires barrage of missiles at Ukraine hitting transport network Russia launched a massive overnight assault on Ukraine, striking civilian and infrastructure targets. Ukraine responded with drone attacks on Russian energy facilities. 08/03/2026
Ukraine Cheap and efficient: Why everyone wants Ukraine’s drone interceptors Since 2022 Kyiv has developed a complex and multi-layered air defence system, which includes mobile fire groups, often using pickup trucks armed with heavy machine guns, and domestically developed interceptors. 06/03/2026
Ukraine Zelenskyy says Druzhba pipeline could be restored in month and a half ""Ukraine can repair the Friendship oil pipeline in a month or a month and a half, although it sees no technical or safety reason to do so,"" Zelenskyy said. ""I will be frank: my position, which is shared with European leaders, is that I would not repair the pipeline."" 05/03/2026
Europe in Motion How do Europeans want the war in Ukraine to end? As Russia's full-scale invasion of Ukraine enters its fifth year, Europeans differ in terms of how much they care if Kyiv wins, according to a new survey. 02/03/2026
No Comment Russian overnight attacks pound Kharkiv and Zaporizhzhia, dozens hurt Russian overnight drone and missile attacks struck Kharkiv and Zaporizhzhia, injuring civilians, damaging apartment blocks and cutting heating to hundreds of homes. 26/02/2026
Ukraine Russia may stage a nuclear false flag incident in Ukraine, report says The US-based Institute for the Study of War said in a report that the Kremlin is looking for ways to divert attention away from “the Russian military’s inability” to achieve Moscow’s objectives, and might cause a nuclear incident to do so. 25/02/2026
No Comment Zelensky and EU leaders honour war dead as Ukraine marks four years Ukraine marks four years since Russia’s invasion with a Kyiv memorial as Zelensky and EU leaders honour the dead and vow to keep resisting. 24/02/2026
No Comment Kyiv region mourns four years of invasion as battles rage in the east Residents in Irpin and Bucha light candles for victims four years after Russia’s invasion, while Zelensky says Moscow has not broken Ukraine and vows a fair peace. 24/02/2026
Ukraine How do Europeans feel about Russia's war in Ukraine four years on? Four years since Russia launched its full-scale invasion of Ukraine, European leaders remain steadfast in support — but does the public feel the same? 24/02/2026
Economy Four years on: The staggering economic toll of Russia's war in Ukraine As Ukraine marks four grim years since the onset of Russia's full-scale invasion on 24 February 2022, the conflict has morphed into an exhausting war of financial endurance. 24/02/2026
Green News Russia-Ukraine war has produced 311 million tonnes of CO2e - report Experts warn that climate change and Russia’s war on Ukraine have created a “vicious cycle” with devastating consequences. 24/02/2026
Ukraine Four years on, Zelenskyy says Putin ‘did not win this war’ On the four-year anniversary of Russia’s full-scale invasion, the Ukrainian president said the country has preserved its statehood as allies vow unwavering support and peace on Kyiv's terms. 24/02/2026
Ukraine Russian troops forced teens to clean torture cells, ex-prisoner says Russia has forcefully deported at least 20,000 Ukrainian children since the beginning of its full-scale invasion. Kyiv managed to bring back 2,000 minors. In some cases, returns took years. 24/02/2026
No Comment Von der Leyen in Kyiv as Ukraine marks four years of Russia’s war Ukraine marks four years since Russia’s invasion as Ursula von der Leyen visits Kyiv, vowing sustained EU financial and military support. 24/02/2026
No Comment Deadly Russian strikes pound Kyiv suburb and energy sites across Ukraine Russia launched massive overnight strikes on Ukraine Saturday, hitting a Kyiv suburb, killing one and injuring at least a dozen including children as Zelenskyy condemned Moscow’s attacks. 23/02/2026
No Comment Ukraine probes deadly Lviv blasts that killed police officer Ukraine probes twin blasts in Lviv that killed a young policewoman and injured dozens, as Zelenskyy reports arrests and Russia is suspected. 23/02/2026
Europe News One dead as Russia launches 50 missiles in overnight attacks Explosions which Ukrainian authorities have called a terror attack have killed a 23-year-old police officer and injured 25 people in the western city of Lviv. 22/02/2026
Ukraine ‘Progress’ on military, ‘dialogue’ on political part of Ukraine talks Ukraine and Russia wrapped up the second day of the US-brokered talks in Geneva on Wednesday after just two hours of negotiations. Zelenskyy said on the military track ""progress"" was made, while on the political track there was ""dialogue"". 18/02/2026
Ukraine Ukraine urges action as Russia launches mass attack before talks Deadly Russian strikes hit Ukrainian regions hours before US-backed Geneva talks, as Zelenskyy urged the world to hold Moscow accountable for continued attacks. 17/02/2026
Ukraine Ukraine is ramping up its counteroffensive regaining territories from Russian troops Ukraine is coming to the talks in Geneva with the significant counteroffensive momentum on the ground. Over the past several days Kyiv troops regained territories from Russian forces, wiping out weeks of Moscow gains, with the help of Elon Musk and Starlink. 17/02/2026
Europe News Kyiv suffers worst winter yet amid continued drone and missile attacks Despite an ""energy truce"" and apparent progress in US-led talks, Russia's assault on Kyiv is wreaking untold suffering as attacks on energy systems plunge hospitals into darkness. The EU is delivering emergency generators – but accelerated EU accession may be the real solution. 17/02/2026
Ukraine Aliyev says Russia 'deliberately attacked' Azerbaijani embassy in Kyiv In a direct statement at the Munich Security Conference, Azerbaijan’s President Ilham Aliyev declared that Russia “deliberately attacked” the Azerbaijani embassy and its infrastructure in Ukraine even after Baku supplied Moscow with the coordinates of its diplomatic missions. 16/02/2026"
14-03-26,Russia Ukraine war,Euronews,Europe,News | Green,https://www.euronews.com/green/green-news,"Green News Climate change is making our days longer. Should we be concerned? Human activity is responsible for slowing Earth’s spin and making days longer, according to a new study. 14/03/2026
Green News Climate change is killing off Austria's glaciers. What's at risk? Soaring temperatures are fuelling the demise of Austria's glaciers, with 'vast implications' for drinking water, power generation, infrastructure and more. 13/03/2026
Green News Greece tests eco-moorings to protect Mediterranean Posidonia seagrass Anchors are damaging Posidonia seagrass, a key Mediterranean habitat that stores carbon, filters seawater and supports marine life. 13/03/2026
Green News Award for leading animal conservationists opens Named after Wolfgang Kiessling, the award recognises scientists and leaders whose work has had a lasting impact on species and biodiversity. 13/03/2026
Green News Would switching to an EV save you money as gas prices spike? “Clean power and electrification combined is what provides the most security,” says Ember analyst Euan Graham. 13/03/2026
Green News ‘Cashing in on a crisis’: G7 urged to tax fossil fuel windfall profits As Europeans brace for higher oil and gas prices, G7 nations are being urged to tax fossil fuel giants profiting from the war on Iran. 13/03/2026
Green News Positive environmental stories from 2026 Eco anxiety is very real, so we share this year's most uplifting stories to prove there’s hope for our climate. 12/03/2026
Green News ‘Loophole’ in EU’s 2040 emissions target could delay climate action Experts warn that the EU’s interim climate targets are being ‘undermined’ by a loophole that comes into effect in 2036. 12/03/2026
Green News How meat lobbyists have infiltrated the fight against climate change Euronews Green exclusive: Big Agriculture’s ‘hidden’ climate strategy has been exposed in a new report. 12/03/2026
Japan Fukushima reflects on recovery 15 years after nuclear plant disaster On 11 March 2011, a magnitude 9.0 earthquake struck northeastern Japan, triggering a tsunami that devastated coastal communities in Tohoku and caused the Fukushima nuclear plant disaster. Fifteen years on, rebuilding continues. 11/03/2026
Green News Spain could be the only EU country to beat energy price hikes Spain spent the last six years investing heavily in wind and solar energy, leading to some of the cheapest power prices in Europe. 11/03/2026
Green News Acid rain and broken food chains: Iran war’s environmental costs Experts warn that the Middle East’s ‘saltwater kingdoms’ are at risk as vulnerable desalination and oil plants become targets. 10/03/2026
Europe News EU fails to deliver on promise of local energy communities, ECA warns People living in so-called energy communities are usually enthusiastic about producing their own renewable energy, but certain complaints and frustrations keep coming up, the latest EU auditors' audit reveals. Resistance from energy generators is also blocking progress. 09/03/2026
Green News IWD: Meet the women fighting for the planet through politics This International Women’s Day, Euronews Green highlights some of the female politicians spearheading the never-ending fight against climate change. 08/03/2026
Green News How hairdressers could be the secret weapon in fighting climate change Hair salons have become a ‘hub of trust’ that could encourage public engagement on climate change, new research has found. 07/03/2026
Green News 10 million-year-old whale fossils discovered on Portuguese beach According to experts, the two whale skeletons found are ""among the most complete in Europe"". 06/03/2026
Europe News Seven EU ministers ask Commission to keep rules on energy pricing Energy ministers from Denmark, Finland, Latvia, Luxembourg, the Netherlands and Portugal are concerned that the EU executive might change market rules, claiming the decision would undermine investments in clean power. Fears for the future of the bloc's carbon market are also growing. 06/03/2026
Green News Climate contradiction? EU faces backlash after 'meaty' label ban The EU Council’s decision to ban ‘meaty’ labels from plant-based products was announced on the same day it green-lit a bold climate target. 06/03/2026
Green News Greece secures €400 million in EU funding for green transition The funding will support strategic investments that increase clean technology capacity. 06/03/2026
Green News Sea levels are higher than thought – putting millions more are at risk A new study highlights a 'methodological blind spot' in the way sea level rise is measured. 06/03/2026
Green News ‘Unprecedented’: Scientists sound climate alarm over Europe’s forests More than 200,000 hectares of European forests could be disturbed annually by 2100, according to a new study. 05/03/2026
Green News ‘Flying above chaos’: Uber-rich flee Dubai on polluting private jets Private jets are up to 14 times more polluting than commercial planes – and are now being used to escape escalating conflict in the Middle East. 05/03/2026
Health news Revealed: How pollution is worsening Europe’s mental health crisis Air pollution, environmental noise, and exposure to toxic chemicals are all linked to a higher risk of mental health issues, the European Environment Agency warns. 05/03/2026
Green News Saharan dust is headed for Europe – is climate change to blame? ""It just shows that we are connected across borders and across continents,"" says Copernicus scientist Mark Parrington. 04/03/2026
Green News Trump Tracker: How the POTUS is gutting climate progress in 2026 Euronews Green is holding the world's most powerful man to account, by documenting all the ways he's sabotaging climate progress this year. 04/03/2026
Green News A climate ‘catch-22’: Can EV batteries cope with extreme heat? Warmer temperatures accelerate the degradation of batteries in EVs, posing a “make-or-break” for people considering making the switch. 04/03/2026
Green News ‘Toxic’: Europe’s most polluting ferry port revealed - see full list Ferries in certain European cities are responsible for more toxic air pollution than all the cars in those cities, a new study warns. 04/03/2026
Green News From beavers to tigers: How wildlife secretly tackles climate change Wild animals are secretly playing a “crucial role” in mitigating human-made climate change through their natural behaviour. 03/03/2026
Green News El Niño may return in 2026 and push global temperatures to new records El Niño could fuel extreme weather and raise temperatures to record highs this year, but how sure can we be that it will return? 03/03/2026
Tech News One year after Northvolt, Swedish tech 'isn't dead yet' Europe is betting big on green tech for energy independence. But can the continent afford another Northvolt? 03/03/2026
Green News Unexpected birth brings hope to near-extinct Amazon tribe With only three women left, the Akuntsu were decimated by a government-backed land grab in the Amazon. 02/03/2026
Green News ‘Chained to fossil fuels’: Iran war ignites calls for green transition After Iran warned that the Strait of Hormuz was closed for navigation, climate groups have urged governments to focus on clean energy. 02/03/2026
Green News Ocean Pact to Ocean Act: Can the EU save its seas and fisheries? From sustainable fishing quotas to sabotage of undersea cables, ocean issues will take the spotlight this March at European Ocean Days. 01/03/2026
Green News Business class flight ban could slash emissions, study suggests Scrapping premium seats could help halve global aviation emissions, according to a major new study. 28/02/2026
Green News Greenpeace fights for its life in €290 million lawsuit The lawsuit relates to decade-old protests against the Dakota Access oil pipeline. 27/02/2026
Green News Why these scientists are calling for a global audit of climate risks A group of experts is pushing for a global assessment of avoidable climate risks to help inform governments and citizens. 27/02/2026
Europe News Italy calls for suspension of EU carbon market The Italian Minister said the Emissions Trading System (ETS) has a ""perverse effect"" and is condemning European companies from being competitive with other countries, urging other member states to back the suspension. 26/02/2026
Green News Inside the sinking theory that glacier melt slows climate change Iron fertilisation has long been touted as a glimmer of hope amid rising emissions – but a new study has seemingly debunked the theory. 26/02/2026
Green News ‘Relentless’: Why have Europe’s storms been so extreme this winter? Previously ""manageable"" storms are transforming into “dangerous disasters” due to human-generated emissions, a new report warns. 26/02/2026
Green News E-waste chemicals found in the brains of dolphins and porpoises A new study has warned that liquid crystal monomers from electronic devices are accumulating in the organs of endangered marine species. 25/02/2026
Green News Microwave meals contain a 'cocktail of microplastics', report warns Microwave meals are convenient – but a new report reveals just how much they could be harming our health and the planet. 25/02/2026
Europe News Europe’s climate policy turning into lobbyists’ playground – report New research reveals that the EU’s Clean Industrial Deal has been transformed into a corporate-driven policy project dominated by heavy industry lobbying, resulting in a shift away from real decarbonisation toward deregulation and weakened climate rules. 25/02/2026
Green News Russia-Ukraine war has produced 311 million tonnes of CO2e - report Experts warn that climate change and Russia’s war on Ukraine have created a “vicious cycle” with devastating consequences. 24/02/2026
Green News US Supreme Court to hear Big Oil bid to dismiss climate suits In their fight to block climate accountability cases, fossil fuel majors recently gained the ear of the highest court in the US. 24/02/2026"
10-03-26,Russia Ukraine war,Euronews,Europe,Find all the latest news about France | euronews,https://www.euronews.com/news/europe/france,"Tech News EU Parliament votes for ‘permanent’ fix for AI copyright The report calls for a European register to list every copyrighted work used to train AI models and whether the artists have opted out. 10/03/2026
Tech News AI ‘Godfather’Yann LeCun raises nearly $1 billion for his startup His startup aims to develop AI systems that can make more informed decisions by leveraging data from cameras and sensors. 10/03/2026
France Thousands march in Paris for women’s rights, led by rape survivor Gisèle Pelicot Thousands of demonstrators gather in Paris for International Women’s Day. Among them mass rape victim Gisèle Pelicot and her daughter Caroline Darian, leading the march to defend women’s rights, denounce sexual violence, and protest the rise of conservatism. 09/03/2026
France France deploys Charles de Gaulle: What to know about the jet carrier Since 2001, the Charles de Gaulle has served as the crown jewel of French military might. It is the only nuclear-powered aircraft carrier outside the US fleet and has just been deployed in the eastern Mediterranean following the outbreak of the Iran war. 05/03/2026
No Comment France: Over 250 migrants cross Channel to England as calm seas return France saw several small boats leave the beach at Gravelines at dawn, carrying migrants hoping to reach England. 04/03/2026
France Macron launches first evacuations and boosts defences in region France says it downed drones “in legitimate defence”, will send the warship to Cyprus and deploy air-defence assets to allies as the first two repatriation flights head to Paris on Tuesday night 03/03/2026
France France to evacuated 'vulnerable' nationals from Middle East 400,000 French nationals are in countries across the Gulf affected by the Iran war, according to French Foreign Minister Jean-Noël Barrot. 03/03/2026
France Macron unveils 'forward deterrence' nuclear plan for Europe Speaking from France’s ballistic-missile submarine base in Brittany, the French president said he “will never hesitate” to protect the country’s “vital interests” and promised “circumstantial deployments” with European allies. 02/03/2026
France Macron to outline France’s nuclear doctrine amid Russia fears The French president's speech is expected by European partners, amid concerns about Russia and uncertainties regarding the reliability of the US nuclear umbrella. 27/02/2026
France France blocks dozens of Russian media sites in propaganda crackdown France's regulator ARCOM has ordred French internet providers to block 35 Russian media sites and dereference four streaming platforms under EU sanctions. 27/02/2026
France Three French men stand trial for Elysée palace tableware theft The former silverware keeper of the French presidency, his partner and an agent from the Louvre are on trial for the theft of hundreds of pieces of precious crockery from the Élysée Palace. 27/02/2026
France Le Pen will not run for president in 2027 with an ankle bracelet Marine Le Pen said on Wednesday she would not run for France’s 2027 presidency if sentenced to wear an electronic bracelet, arguing it would make campaigning impossible. 26/02/2026
France Iranian woman jailed in France may become pawn in Tehran prisoner swap Convicted in France for “glorifying terrorism”, the Iranian national is being mentioned as part of a potential prisoner-swap scenario with Tehran involving French detainees Cécile Kohler and Jacques Paris, who have been released from jail but cannot leave Iran. 26/02/2026
France Festivals cut ties with several DJs over sexual misconduct allegations An alleged former employee of a Paris-based booking agency released a series of screenshots and text messages involving DJs and accused them of sexual misconduct, causing broader backlash. In the meantime, many performances by artists involved were cancelled while some reject the allegations. 26/02/2026
France France debates if bans on extremist groups work amid far-left probe The Paris public prosecutor’s office has opened an investigation into whether the banned far-left movement La Jeune Garde has been reformed. The case reignited a debate in France: how effective are “dissolutions” at dismantling extremist networks? 26/02/2026
Cinema Park Chan-wook named as 2026 Cannes Jury President Director Park has previously premiered four films in Competition in Cannes and won three Palmes at the festival for his films 'Oldboy', 'Thirst' and 'Decision To Leave'. 26/02/2026
France 1,500 paratroopers take part in Orion-26 exercise in western France France and 24 allied countries are conducting large-scale military drills to prepare for high-intensity conflict, amid escalated threats from Russia. 25/02/2026
Europe News Macron to outline France’s role in Europe’s nuclear deterrence Europe has two nuclear-armed powers: France and the UK. While Macron's initial offer to expand the French nuclear deterrence to European partners went largely ignored in 2020, it is now gaining traction. 25/02/2026
Culture news Élysee moves swiftly to appoint Christophe Leribault as Louvre chief The French government has named art historian Christophe Leribault as the new director of the beleaguered Paris Louvre museum following the resignation of Laurence des Cars. 25/02/2026
France France ends record 40-day streak of consecutive rain Authorities urged the public to exercise caution, warning that many affected areas remain under flood risk. The country's national meteorological service says rain is forecast to resume on Thursday evening. 24/02/2026
Culture news Louvre chief Laurence des Cars quits in latest crisis at French museum Laurence des Cars has quit as director of the Paris Louvre Museum as the fallout continues over the daylight robbery which saw priceless crown jewels stolen from the world's most popular museum. 24/02/2026
Art French artist JR reveals plans to turn Pont Neuf bridge into a 'cave' French artist JR will transform Paris’ famous Pont Neuf bridge into a walk-through “cave” with sound and augmented reality in a tribute to artists Christo and Jeanne-Claude. 24/02/2026
France France blocks US ambassador's government access after summons no-show France's Foreign Ministry had summoned US Ambassador Charles Kushner to explain comments made by the Trump administration about the killed far-right activist Quentin Deranque. 24/02/2026
Travel News Iconic Paris observation deck to close for renovations next month Tour Montparnasse, which is the tallest skyscraper within Paris city limits, will close until at least 2030. 23/02/2026
France French probe reveals Russian security agents on seized shadow tanker Two Russian nationals working for a private security company were confirmed to have been onboard a tanker seized by France in September, sources told French media. The vessel was suspected to be part of the Kremlin’s shadow fleet, carrying Russian oil and gas to evade Western sanctions. 23/02/2026
France After Swiss Alps bar fire, France’s nightlife comes under scrutiny Since the deadly fire in the Swiss ski resort of Crans-Montana, French authorities have stepped up inspections of bars and nightlife venues. Euronews spoke to venue managers to see how they are adapting. 23/02/2026"
