published_date,topic,source,region,title,url,full_text
08-03-26,Iran war,BBC,Europe,Israeli president says 'mind boggles' at doubts over legality of Iran war,https://www.bbc.com/news/articles/clyxp780xvro,"'Mind boggles' at doubts over legality of Iran war, Israeli president says
Israel's President Isaac Herzog has told the BBC his ""mind boggles"" at questions over the legality of the war on Iran, saying it was necessary for self-defence in the face of Tehran's nuclear and military ambitions.
Iran's leaders had not adhered to international law themselves, he told the Sunday with Laura Kuenssberg programme, adding that the joint offensive with the US would make the region and Europe safer.
Herzog also defended Israel's ongoing offensive against Hezbollah in Lebanon, saying it was ""doing [the Lebanese government's] work for them"" to dismantle the armed group.
Last week, senior ministers reportedly raised concerns about the legal basis for the war when debating UK involvement.
Britain has not participated in offensive operations but has allowed the US to use its air bases to carry out ""defensive"" strikes against weapons being used in retaliatory attacks across the Middle East.
Pressed on doubts over the legality of the war, Herzog said it was ""quite amazing"" to question it ""when you think about the fact that Iran did not adhere to any rule of international law"", and given concerns in the UK over Iranian-backed domestic security threats.
In October, MI5 said it had identified 20 ""potentially lethal"" Iran-backed plots since January 2022.
The Israeli president pointed to the killing of Iranian protesters earlier this year, its backing of armed proxies in the region, and a drone attack against a British air base in Cyprus as evidence of the threat posed by Iran.
He continued: ""It mind boggles me that [legality] is the focus rather than on the future of the Middle East and doing peace in the Middle East.""
Herzog said the war is ""clearly self-defence, which is not only self-defence for us but self-defence for Europe, for Britain, for the entire region - look how they are bombarding all their neighbours"".
Israel also launched a new offensive against Hezbollah after the Iran-allied group fired missiles over the border in response to the killing of Iran's Supreme Leader Ali Khamenei.
Israel has hit targets in southern Lebanon and southern suburbs of the capital Beirut, where the group has a strong presence, while its troops have pushed further over the border into the country.
Herzog told the BBC that Israel had been ""attacked vehemently by missiles"" launched by Hezbollah, and that the government in Lebanon ""object to it totally"" but ""don't have the power"" to disarm them.
On Sunday, Lebanon's health minister said the death toll in the country had risen to 400, while the Israel Defense Forces said two soldiers had been killed in southern Lebanon.
Meanwhile, Seyed Ali Mousavi, the Iranian ambassador to the UK, said Iran would act in its own ""self-defence"" if the UK joined offensive operations.
On Saturday, US President Donald Trump strongly criticised Sir Keir Starmer, accusing him of seeking to ""join wars after we've already won"" and signalling he would reject an offer of further military assistance from Britain, which he described as ""our once great ally"".
Foreign Secretary Yvette Cooper told the BBC that Starmer had been ""right to stand up for Britain's interests"" in his position on the war, adding that the UK government would not agree with Trump ""on every issue"".
Starmer and Trump spoke on the phone on Sunday, their first direct conversation in over a week."
28-02-26,Iran war,BBC,Europe,Why did US and Israel attack Iran and how long could the war last?,https://www.bbc.com/news/articles/cx2dyz6p3weo,"Why did US and Israel attack Iran and how long could the war last?
Conflict across the Middle East continues to rage after the US and Israel launched wide-ranging strikes on Iran, killing the country's supreme leader on 28 February.
Iran has continued to respond by launching attacks on Israel and US-allied states in the Gulf, which have extended to non-military targets, including civilian sites and energy facilities.
The fighting has escalated quickly, spreading to Lebanon, with casualties and damage mounting on all sides.
What has been happening in Iran?
The US and Israel first attacked Iran on 28 February, targeting its missile infrastructure, military sites and leadership in the capital, Tehran, and across the country.
Iran's Supreme Leader, Ayatollah Ali Khamenei, who had led the country since 1989, was killed during the first wave of strikes. Israel's military said dozens more senior figures in the powerful Islamic Revolutionary Guard Corps (IRGC) were also killed.
Following Khamenei's death, on 8 March his son, Mojtaba Khamenei, was appointed as his successor.
On 13 March, US Defence Secretary Pete Hegseth said Mojtaba Khamenei had been ""wounded and likely disfigured"" in new strikes, pointing out that he had not been seen in public in recent weeks.
Tehran dismissed Hegseth's claim, with Iranian Foreign Minister Abbas Araghchi saying ""there is no problem with the new supreme leader"".
The US and Israel have continued to target key sites linked to Iran's nuclear programme. Iran has repeatedly insisted its nuclear programme is entirely peaceful.
The two have also ramped up attacks on Iranian oil refineries in recent days. The US has focused on Kharg Island - home to a major terminal that is considered Iran's economic lifeline.
On 14 March, the US-based group Human Rights Activists in Iran (HRANA) reported 3,040 people had been killed in Iran – including 1,122 military personnel and 1,319 civilians, of which at least 206 were children. Another 599 fatalities were ""unclassified"" (civilian/military).
Earlier, on 6 March, Iran's ambassador to the UN said that more than 1,300 people had been killed.
Iran accused the US and Israel of launching an attack on a girls' school near an IRGC base in southern Iran on 28 February, saying 168 people, including around 110 children, were killed.
The US said it was investigating the incident, while Israel said it was ""not aware"" of any military operations in the area.
Expert video analysis shows a US Tomahawk missile hit a military base near the school, BBC Verify has reported. Defence Secretary Pete Hegseth is now facing questions from Democrats over possible US involvement.
Access to Iran for international journalists is limited, and internet connectivity in the country has been almost entirely restricted.
Outside its territory, an Iranian warship was also sunk by a US submarine in the Indian Ocean near the coast of Sri Lanka on 4 March. At least 87 people were killed.
Where has Iran attacked?
Iran has described the US and Israeli strikes as ""unprovoked, illegal and illegitimate"", and has carried out widespread missile and drone attacks in response.
The IRGC said it had targeted Israeli government and military sites in Tel Aviv and elsewhere.
As of 15 March, Israeli authorities said 12 people – all civilians – had been killed by missile fire since the start of the war.
The deadliest strike - nine killed - was on the city of Beit Shemesh, west of Jerusalem, on 1 March.
There have also been strikes in countries hosting US bases – Qatar, Bahrain, Jordan, the United Arab Emirates (UAE) and Kuwait – and US-allied Oman and Saudi Arabia.
As of 13 March, 13 US service members had been killed.
Iran has been accused of widening its attacks to other targets, including oil facilities, shipping and civilian sites, such as hotels in Dubai.
At least 18 people have been killed across the Gulf so far, most of them security personnel or foreign workers.
Six people have been killed in the UAE and another six in Kuwait, while Oman, Saudi Arabia and Bahrain have all reported two deaths in each of their countries.
Strikes have also been reported in Iraq, with the country saying it had been struck by Iran on 6 March after explosions at Erbil airport.
A French soldier was killed by a drone at a Kurdish military base in northern Iraq.
Also in Iraq, the Popular Mobilization Forces (PMF) - formed in the last decade to fight the Islamic State group - said 27 of their members have been killed. Iran supports militias under the umbrella of the Islamic Resistance in Iraq (IRI), which are part of the PMF.
Turkey said Nato air defences have shot down three Iranian missiles over its airspace. Azerbaijan also accused Iran of attacking an airport with drones.
The US and its Arab allies issued a joint statement condemning Iran's attacks, saying ""the targeting of civilians and of countries not engaged in hostilities is reckless and destabilising behaviour"".
On 14 March, the Palestinian armed group Hamas, which operates in Gaza, urged Iran to stop attacking Gulf states, in a rare appeal to its key ally.
Elsewhere, a British military base in Cyprus was struck by a drone, according to the UK Ministry of Defence. Western officials later said the drone was not launched from Iran.
On 7 March, Iranian President Masoud Pezeshkian broadcast a video message on Iranian state television apologising to neighbouring countries that were attacked.
Pezeshkian said Iran did ""not intend to invade neighbouring countries"" adding that the leadership had issued an order to the armed forces that ""from now on"", the military should not attack neighbouring countries ""unless attacked first"".
What's happening in Lebanon?
A new front in the war opened in Lebanon on 2 March when the Iran-backed group Hezbollah fired rockets at Israeli positions, saying it was seeking to avenge Khamenei's assassination.
Israel launched attacks in response, hitting Beirut and parts of southern Lebanon.
In Israel, the defence minister said on 3 March that ground troops would ""advance and seize additional strategic areas in Lebanon"" in order to stop attacks from Hezbollah.
Since then, Israel has launched regular strikes on southern Lebanon and Beirut's southern suburb of Dahieh, where it says it has struck Hezbollah command centres and weapons storage facilities.
Attacks have also spread to central Beirut, hitting two hotels and the city's shoreline where displaced people have been sleeping.
As of 14 March, Lebanon's health ministry said the attacks had killed 826 people, including 106 children.
More than 700,000 people, including around 200,000 children, are displaced from their homes, the United Nations said.
The Israeli military also reported two of its soldiers had been killed as of 8 March.
Why have the US and Israel attacked Iran?
Israeli Defence Minister Israel Katz described the first attacks on 28 February as a ""pre-emptive strike"" to ""remove threats against the state of Israel"", although he did not explain why there was a need to take military action at this time.
US Secretary of State Marco Rubio said on 2 March the US knew there was going to be Israeli action, which meant America had to act ""pre-emptively"" in the face of expected Iranian attacks on American forces.
Israel Defense Forces (IDF) spokesman Brig Gen Effie Defrin revealed that the military operation was preceded by months of strategic deception that caught Iran off guard.
In the US, some lawmakers have called for President Donald Trump's administration to provide evidence that Iran posed a threat before Washington went to war.
But there are also underlying reasons.
Israel and the US – its closest ally – have been arch-foes of Iran since the Islamic revolution in 1979. The Iranian leadership has consistently called for Israel's elimination and denounced the US as its greatest enemy.
The two countries have led Western opposition to Iran's nuclear programme, claiming Iran is seeking to develop a nuclear bomb - something Iran has vehemently denied.
They attacked Iranian nuclear and military sites in June 2025 in a war which lasted for 12 days.
Since then, they have claimed Iran has been trying to rebuild its nuclear programme and develop missiles capable of delivering nuclear weapons.
Trump said these missiles could eventually reach the US, though this has not been supported by US intelligence assessments.
For its part, Israel considers Iran a threat to its existence and wants the complete removal of Iran's nuclear and missile programme, as well as regime change.
The US first openly talked in January about potentially attacking Iran when its security forces cracked down on protesters with deadly force.
But the US and Iran began negotiations and appeared to be making progress until Trump said he was ""not happy"" with the way the talks were going on 27 February. Hours later, the US and Israel began attacking.
On 6 March, Trump said there would be ""no deal"" with Iran unless it agreed to an ""unconditional surrender"".
On 14 March, the US president said Tehran wanted to make a deal - but he himself did not want to yet ""because the terms are not good enough"".
How is the war affecting the economy and energy prices?
Instability in the Middle East has begun to impact the global economy.
Iran has been accused of attacking ships in the Gulf, forcing the effective closure of the Strait of Hormuz - a key artery accounting for about 20% of global oil and gas supply.
Attacks have also been reported on major oil and gas hubs, including in Oman's Duqm commercial port and the UAE's Fujairah terminal.
The strikes have prompted some of the world's largest producers of oil and gas to suspend production, including Qatar's liquefied natural gas (LNG) facilities and Saudi Arabia's largest domestic refinery.
Oil and gas prices have surged, prompting warnings about the impact on the global economy and cost of living.
The oil price reached nearly $120 a barrel on 9 March, but dipped after Trump said the war with Iran will end ""very soon"".
However, the US president later threatened to hit Iran ""20 times harder"" if it stopped oil flowing through the Strait of Hormuz.
Multiple cargo ships have been hit in the strait by ""unknown projectiles"", British maritime security agency UKMTO said.
One tanker off the coast of Kuwait was hit by a ""large explosion"" on 5 March, causing an oil spill, UKMTO said.
One person was killed after two foreign fuel tankers were hit by explosions near the Iraqi port of Umm Qasr on 12 March.
Is it safe to travel to the region and how long could the war last?
On 9 March, Trump made a range of remarks about when the war would end.
Speaking to CBS News, Trump said the war ""is very complete, pretty much"", adding: ""We're very far ahead of schedule.""
But later that day he suggested the US would ""go further"".
He added that the US was ""very close to finishing"" what he called an ""excursion"".
Trump also laid out an expansive mission for the war. His goal, he said, was to ensure that Iran could not develop weaponry to target the US, Israel or any American allies ""for a very long time"".
White House press secretary Karoline Leavitt previously suggested the war could last up to six weeks.
Israeli Prime Minister Benjamin Netanyahu said at the start of the war that the campaign would ""continue as long as it is needed"".
The war has prompted one of the most serious disruptions to global travel since the Covid-19 pandemic, with airspace closures and thousands of flights grounded across the Middle East.
On 6 March, airline Etihad announced it would begin operating limited flights from Abu Dhabi.
Emirates also resumed some flights, following the partial re-opening of regional airspace.
Airspace in Qatar partially reopened on 7 March, in response Qatar Airways said it intended to operate repatriation flights. It resumed limited operations to and from Doha on 8 March.
The UK Foreign, Commonwealth and Development Office (FCDO) said anyone planning to travel to the Middle East should check its website for advice relating to their destination.
Additional reporting by Mallory Moench, Raffi Berg, Emily Atkinson, Olivia Ireland, Robert Greenall, Hafsa Khalil, Gabriela Pomeroy, and BBC Persian"
01-03-26,Iran war,BBC,Europe,Watch: Retaliations continue on day two of US-Israel attacks on Iran,https://www.bbc.com/news/videos/cvgk8vj56v1o,"Watch: Retaliations continue on day two of US-Israel attacks on Iran
US President Donald Trump warned ""there will likely be more"" US casualties during operations in Iran in a statement posted on Truth Social. This comes as US Central Command (Centcom) said three US service members have been killed in action and five ""seriously wounded"".
In Israel, nine people have been killed after a missile strike in the city of Beit Shemesh, according to medical services.
Meanwhile Iranian officials say at least 153 people including children were killed after a reported strike hit a school on Saturday, according to Iranian officials. Iran has blamed the US and Israel. Centcom said it was looking into reports of the incident, while Israel's military said it was ""not aware"" of any IDF operations in the area.
The UAE has said three people have been killed by Iranian attacks since Saturday, while in Kuwait, one person has reportedly been killed.
Video edited by Amy Walker."
12-03-26,Iran war,BBC,Europe,Swinney seeks UK meeting over US military use of Prestwick Airport,https://www.bbc.com/news/articles/ce8wlr9k27wo,"Swinney seeks UK meeting over US military use of Prestwick Airport
First Minister John Swinney is seeking a meeting with the UK government over American military use of Prestwick Airport amid calls for the US Air Force to be banned from the site.
It comes as the BBC has documented some American military planes stopping over at the Scottish government-owned airport, on their way to support the US-Israeli airstrikes against Iran.
A Ministry of Defence spokesperson said the UK had authorised the US to use British military bases for specific defensive missions to protect the UK.
A Scottish government spokesperson said Swinney had asked for clarity that US planes were not part of offensive operations.
He has previously suggested the military action in Iran is ""incompatible with the international rules-based system"".
Last week, at First Minister's Questions, Swinney was challenged to ban US planes from Prestwick by the Scottish Greens who accused him of ""sitting on his hands"".
Pressed further on the matter by the BBC's Sunday with Laura Kuenssberg programme, Swinney said his government would ""explore"" and ""consider"" a ban if it was confirmed the planes were involved in the airstrikes.
Using publicly available flight logs, BBC Scotland has now found evidence that planes that have passed through Prestwick in recent weeks are directly involved in supporting the US military action in the Middle East.
In the military build-up ahead of strikes on Iran, the US redeployed scores of mid-air refuelling tankers to bases in Europe and the Middle East.
Three Boeing KC-135 Stratotankers stopped off at Prestwick Airport last month on the way to their final destination in Israel.
From there, they have flown dozens of missions since the start of Operation Epic Fury, the US-Israeli war with Iran.
It is not possible to know exactly which strikes the tankers have supported.
But defence analyst Jonathan Marcus, a former BBC correspondent who reported on the Iraq War from the region, says their role has been crucial to the operation.
""What they do is they give the strike aircraft, or indeed other aircraft that might be operating in the mission greater range, or indeed, greater endurance,"" Marcus said.
""Iran is a huge country. There may well be operations which aren't simply going out and hitting designated targets, but also loitering in particular areas, ready to be called in if mobile missiles are seen on the ground.
""That requires endurance, it requires being able to stay up over the target area for some period of time.""
The three tankers in question left Riverside Air Force Base in California on 17 and 18 February, bound for Prestwick Airport.
Between 19 and 22 February, they flew on to Saudi Arabia, before deploying to Israel.
On 28 February, the start of Epic Fury, one of the planes was airborne over Israel, briefly broadcasting its position as it flew east, towards Iran.
Since the start of March, all three planes appear to have been based at Ben Gurion Airport near Tel Aviv, where over a dozen Stratotankers have been photographed.
The three planes that transited through Scotland have flown at least 30 missions from Israel, turning off transponders that record their position as they head east towards Iran, and turning them back on hours later as they return to land.
In what is a highly coordinated joint operation, Marcus also believes the US Air Force is likely to be refuelling Israeli aircraft, as well as its own.
""The scale of the Israeli involvement is roughly equivalent in terms of strike aircraft to that of the Americans,"" Marcus said.
""But the Israeli Air Force is much weaker in terms of things like tankers. And so I'm sure American tankers are helping to sustain the Israeli aircraft as well, and that is an important force multiplier to keep up the pressure on Iran.""
Prestwick Airport is also used as a stopping off point for US Air Force cargo planes flying between the United States and bases across Europe and the Middle East.
Since the start of the conflict in Iran, American allies in the Middle East like Kuwait and the United Arab Emirates have also landed military cargo planes at Prestwick.
While it is not possible to know what any individual flight is carrying, Marcus told the BBC ""routine, regular supply corridors are vital"" for a major air campaign, to replenish materials including spare aircraft parts and munitions.
The Scottish government bought Prestwick Airport for £1 in 2013.
It operates as an arms-length company, and turned a profit of £3.5m in the 2024/25 financial year, with refuelling services providing its biggest source of revenue.
US government spending records show the Department of Defence spent £15.3m at Prestwick in 2025, and nearly £105m in total since 2018.
No American combat aircraft are known to have stopped at Prestwick since the start of the airstrikes, although following a change in UK government policy, US Air Force bombers are now flying missions directly from RAF bases in England, where a significant number of refuelling tankers are also based.
Patrick Harvie MSP, external affairs spokesman for the Scottish Greens, said the Scottish government said in 2024 that Israeli military aircraft would not be serviced at Prestwick Airport.
""That makes it even more important that ministers are transparent about what role the airport may be playing when the US military aircraft passing through it are so closely linked to Israel,"" he said.
""If ministers were willing to take action in relation to Israeli military aircraft, they must explain why the same scrutiny and standards are not being applied to US Air Force aircraft which are potentially supporting the same military operations as Israel.""
Harvie added: ""The first minister has said he was willing to consider banning the US from using the airport, based on the evidence. He now has more than enough to act.""
A Scottish government spokesperson said: ""Non-UK military flights using UK airspace need permission from the Ministry of Defence.
""The Scottish government is not provided with information on the purpose of military flights using Scottish airports.
""Ministers have therefore sought clarity from the UK government that no aircraft have passed through Scottish government-owned airports as part of offensive operations against Iran.
""In addition, the first minister is seeking a meeting with the Cabinet Office to discuss this matter.
""As the first minister set out previously, once received, this information from the UK government will inform decision-making on the use of Prestwick Airport.""
A Ministry of Defence spokesperson said: ""Prestwick is a civilian international airport owned by the Scottish government and is not being used by the US to launch military strikes.
""The UK has authorised the United States to use British military bases for specific defensive missions to destroy Iran's missile capabilities which are threatening British people, bases, and our partners in the region.
""We won't be providing a running commentary on our allies' operations, including their use of our bases."""
