published_date,topic,source,region,title,url,full_text
15-03-26,Russia Ukraine war,Euronews,Europe,Zelenskyy: Kyiv waiting on US and Russia for next round of peace talks,https://www.euronews.com/my-europe/2026/03/15/zelenskyy-says-ready-for-another-round-of-peace-talks-but-waiting-on-us-and-russia,"US-led peace talks between Ukraine and Russia had been under way in the United Arab Emirates but were placed on hold amid the Iran war.
President Volodymyr Zelenskyy said on Sunday that Kyiv is ready for the next round of trilateral peace talks to end Russia's full-scale invasion of Ukraine, but that it was up to Washington and Moscow to decide where and when to meet.
Zelenskyy said that Washington had proposed to meet in the US next week, but that Russia did not want to meet there.
“We are waiting for a response from the Americans. Either they will change the country where we meet, or the Russians must confirm (a meeting in) the US,” Zelenskyy said in a media briefing on Saturday.
“We are not blocking any of these initiatives. We want a trilateral meeting to take place.”
Peace talks had been under way in the United Arab Emirates earlier this year, but were put on hold after the Iran war erupted following joint US-Israeli strikes on Iran late February.
As Iran began launching retaliatory strikes, the conflict quickly spread across the wider Middle East, which Zelenskyy feared could draw global attention away from Russia's war against Ukraine.
The Ukrainian leader also warned that Iran could drain the air defence stockpiles Ukraine depends on to counter Russian missile attacks.
Eleven countries have requested Kyiv’s help in countering Shahed-type drones amid the Iran war and Tehran's ongoing attacks against the Gulf states, Ukrainian President Volodymyr Zelenskyy said last week.
He explained that Ukraine is willing to help, but only those who help Kyiv “protect the lives of Ukrainians and the independence of Ukraine.”
Zelenskyy also pushed back against President Donald Trump's recent statement that the US did not need Ukraine's help on drone technology. Zelenskyy said, however, that Washington had reached out to Kyiv ""several times"" to request assistance, without offering details.
Zelenskyy said he wanted to sign a deal worth $35–50 billion (€30.5-43.6 billion), but did not understand why the US did not sign the document.
Russia continues attacks on Ukraine amid stalled peace talks
Meanwhile, Russia continues to launch near-daily attacks on Ukraine.
""Over the past week alone, the Russians struck Ukraine with 1,770 attack drones, more than 1,530 guided aerial bombs, and 86 missiles, including more than 20 ballistic ones,"" Zelenskyy wrote on X.
Overnight into Sunday, Russia launched 97 drones, according to Ukraine’s Air Force, which said it shot down 90 of them. Five drones hit targets at five locations, while debris from intercepted drones fell in two other areas.
In the Kherson, Kharkiv and Zaporizhzhia districts, five people were killed and dozens injured, local media reported, citing local authorities. Meanwhile in the Sumy and Dnipropetrovsk districts, at least six people were injured, reports added.
A Russian drone strike was also reported in the Chernihiv district, which had targeted a checkpoint, killing one person, according to Head of Chernihiv City Military Administration, Dmytro Bryzhynskyi.
""Unidentified explosive devices dropped from the UAV are still detonating; the appropriate services are working at the scene,"" he wrote on Telegram."
15-03-26,Russia Ukraine war,Euronews,Europe,Belgian PM De Wever calls for talks with Russia to end Ukraine war,https://www.euronews.com/my-europe/2026/03/15/belgian-pm-de-wever-europe-must-strike-a-deal-with-russia-to-end-ukraine-war,"Belgian PM Bart De Wever says Europe must negotiate with Russia to end the war in Ukraine and restore cheap energy access, as EU leaders remain divided on engaging Moscow.
Belgian Prime Minister Bart De Wever has called on Europe to reach a deal with Russia to end the war in Ukraine, in an interview published in the Belgian newspaper L'Echo.
De Wever argued that a negotiated settlement is also necessary to restore access to cheap energy.
The European Union remains divided on the issue. French President Emmanuel Macron, Italian Prime Minister Giorgia Meloni and Hungarian Prime Minister Viktor Orbán have called for direct talks with Moscow, while Poland and the three Baltic states are firmly opposed.
""In private, European leaders agree with me, but no one dares to say it out loud. We must end the conflict in the interest of Europe, without being naïve towards Putin,"" De Wever said.
He added that Europe must not repeat past mistakes in its relationship with Russia, stressing the need to rearm and deploy troops to its eastern borders.
""At the same time, we must normalise relations with Russia and regain access to cheap energy. That is common sense,"" De Wever said.
The Prime Minister argued that Europe's dual strategy of supporting Ukraine militarily and squeezing Russia's economy has become untenable without the backing of the United States.
""Given that we are unable to pressure Putin by sending weapons to Ukraine, and cannot suffocate his economy without US support, only one method remains: making a deal,"" he said.
De Wever also said his government has no plans to introduce state subsidies to offset rising energy prices linked to the war in the Middle East.
""I am not going to panic and throw billions out the window, as the previous government did,"" he said.
The EU has been working to reduce its dependence on Russian energy imports since the start of the full-scale invasion of Ukraine in 2022. It has set out plans for a complete ban on Russian fossil fuel imports next year.
Hungary and Slovakia continue to resist those measures, arguing that Russian energy supplies are essential to their energy security.
Earlier this week, several European leaders criticised President Donald Trump's decision to lift sanctions on Russian oil at sea, a move aimed at price tensions in global energy markets as a result of the war in Iran.
The US granted countries a temporary permit to purchase Russian oil currently stranded at sea this week.
German Chancellor Friedrich Merz and European Council President António Costa condemned the move, warning it could have a negative impact on European security."
05-03-26,Russia Ukraine war,Euronews,Europe,Latest episodes and news | 12 minutes with | Euronews,https://www.euronews.com/programs/12-minutes-with,"12 minutes with Iran 'cannot be allowed to hold global economy hostage' - UAE minister UAE Minister of State Lana Nusseibeh sent a clear message to EU governments in a Euronews interview, stating that stability in the region is closely tied to Europe’s own economic and security interests.
12 minutes with Finnish minister denounces Spain's mass regularisation of migrants Finnish Minister of Interior Affairs Mari Rantanen, who has spearheaded a significant tightening of immigration to the country, told Euronews that Europe’s migration policies will not be resolved with solidarity. 05/03/2026
12 minutes with Trump may accept leadership from reformed Iran regime, Petraeus says The former CIA chief David Petraeus told Euronews it is possible a more moderate figurehead could emerge who “wants to sail straight”, but that this would be “a dramatic departure” from the current situation. 03/03/2026
12 minutes with Hungary blocking Ukraine loan 'illogical' - Swedish foreign minister Sweden's foreign minister told Euronews that the EU must find a way to push through its €90 billion loan for Ukraine and put more pressure on Hungary. 23/02/2026
12 minutes with Romanian minister backs EU joint debt in push to reboot economy Minister Alexandru Nazare also supports the more controversial E6 club of economic heavyweights, saying if it succeeds, it's a ""good thing"" for Europe. 17/02/2026
12 minutes with French Defence Minister questions whether Russia 'really wants peace' The French Defence Minister told Euronews that, based on what she witnessed on a recent visit to Ukraine, she questioned whether Russia wants peace. She emphasised, however, the importance of continued dialogue with Moscow. 12/02/2026
12 minutes with Council of Europe boss calls for full backing for Ukraine Tribunal The head of Europe’s leading human rights organisation, the Council of Europe, told Euronews that European countries need to provide the budgetary resources and political will to ensure accountability for Russian war crimes committed in Ukraine. 05/02/2026
12 minutes with US interests unclear with ‘no deal’ on table - Greenlandic minister Minister Naaja Nathanielsen told Euronews that the Greenlandic government is seeking clarity on the Trump administration’s demands, cautioning that ‘full access’ to her Arctic country’s mineral resources would cross its red lines. 26/01/2026
12 minutes with 'President Trump is trying to replace the UN', says Belgian FM US President Donald Trump is trying to supplant the United Nations with his supposedly transitional ""Board of Peace"", Maxime Prévot told Euronews. 20/01/2026
12 minutes with US military action could have ‘decisive effect’ on Iran, Bolton says John Bolton, a former national security advisor to President Trump, says he believes the US will opt for ""targeted strikes"" on Iran as the region braces for a militarily intervention. Trump teased American 'help is on its way.' 14/01/2026
12 minutes with Belgium open to housing foreign prisoners in other countries, minister says Belgium’s Migration Minister Anneleen Van Bossuyt is looking at “every possible solution” to increase the number of irregular migrants returned from Belgium, including renting prison space abroad to house foreign prisoners. 08/01/2026
12 minutes with Danish minister hails progress made as EU presidency nears end As Denmark prepares to hand over the EU Presidency torch to Cyprus, its European Affairs Minister tells Euronews that her country made significant gains on priority points, from simplification to migration. 18/12/2025
12 minutes with 'Let's prove them wrong': Spanish economy minister responds to US Spanish Economy Minister says Europeans must stay united and keep focused on integration after the Trump administration said the continent's economy is suffocating under excessive regulation and weak leadership. 12/12/2025
12 minutes with European Ombudswoman weighs in on von der Leyen’s vanishing texts The European Ombudswoman has defended the European Commission’s commitment to transparency amid criticism that President Ursula von der Leyen is running an increasingly opaque operation, but recognised ""challenges"" in upholding free access to documents. 12/12/2025
12 minutes with Belgian drug chief asks EU to pressure apps to work with authorities Belgium’s first-ever National Drug Commissioner, Ine Van Wymersch, tells Euronews that the European Union needs to crack down on encrypted messaging platforms that allow drug traffickers to coordinate their criminal operations. 05/12/2025
12 minutes with Former FM Kuleba: Europe's decision-making on Ukraine 'embarrassing’ Ukraine’s former foreign minister tells Euronews’ 12 Minutes With that Europe needs to ""pull itself together"" amid the diplomatic push for peace, saying the current 'pace of decision-making' means there ""are no good times for Europe ahead."" 27/11/2025
12 minutes with Europe must reinvent growth formula in new world, Eurogroup boss says Europe must reinvent its growth model in changing world hit by tariffs and force, Eurogroup boss tells Euronews in exclusive interview. 14/11/2025
12 minutes with North Macedonia ‘bullied’ on its EU membership path, PM Mickoski says Having spent over two decades in the EU membership waiting room, North Macedonia hopes the wait will finally be over as Prime Minister Mickoski tells Euronews the accession of his country has been delayed by “artificial disputes”. 07/11/2025
12 minutes with EU risks ‘losing credibility’ if it fails to enlarge, Montenegro warns Montenegro is a frontrunner among EU candidate countries and hopes to wrap up accession talks with Brussels next year. Failure to secure the country’s accession could dent the EU’s credibility and send a ‘horrible signal’ to other candidates, its deputy Prime Minister warns. 06/11/2025
12 minutes with ‘We don't accept lectures’ when it comes to the fight against corruption, PM Rama says Albania is committed to joining the EU by 2030 in an “ambitious but doable” timeline, Edi Rama told Euronews. The European Commission's annual check-up of where the EU candidate countries stand on their membership paths came out largely positive for Tirana. 05/11/2025
12 minutes with 'Put money where the problem is': Lithuania urges eastern flank action Lithuania's Foreign Minister Kęstutis Budrys tells Euronews that defending the eastern flank is an existential question after a series of destabilising airspace incursions. 28/10/2025
12 minutes with Romanian FM backs Trump's push to fully wean EU off Russian energy Neighbouring Slovakia and Hungary are resisting pressure from the Trump administration to suspend their purchases of Russian energy products. 17/10/2025
12 minutes with EBRD chief: Bank ‘even more important’ amid global tensions, aid cuts Odile Renaud-Basso dismisses decline of multilateralism as a threat to the mission of the European Bank for Reconstruction and Development (EBRD) and foresees a role in post-war Ukraine and Gaza’s post-war recovery. 14/10/2025"
