published_date,topic,source,region,title,url,full_text
27-02-26,Russia Ukraine war,BBC,Europe,"At least 55 Ghanaians killed in Russia-Ukraine war, Minister Samuel Okudzeto Ablakwa says",https://www.bbc.com/news/articles/cgl5gxg3zj9o,"At least 55 Ghanaians killed in Russia-Ukraine war, minister says
At least 55 Ghanaians have been killed fighting in the war in Ukraine, with two others currently held as prisoners of war, Ghana's foreign affairs minister says.
On a trip to Kyiv, Samuel Okudzeto Ablakwa said that about 272 Ghanaians are believed to have been lured into the conflict since 2022, citing Ukrainian authorities.
Ablakwa described the figures as ""depressing and frightening,"" saying Ghana ""cannot turn a blind eye to these heartbreaking statistics"".
He did not say whose side the Ghanaians had been fighting on but Ukraine's foreign minister said on Wednesday that more than 1,700 people from 36 countries in Africa had been recruited to fight for Russia.
The 55 Ghanaians is the highest number of casualties from a single African country to have been officially confirmed in the Ukraine-Russia war.
Local media in Cameroon have reported that 94 of its nationals have died in the conflict, but the authorities have not commented on these figures.
Two South Africans and at least one Kenyan have died in the conflict.
Ablakawa said the casualty figures were ""not just numbers, they represent human lives, the hope of many Ghanaian families and our nation"".
He said the Ghanaian government was committed to ""tracking and dismantling all dark web illegal recruitment schemes"" as well as launching intensive public awareness campaigns to prevent the country's youth from being drawn into the conflict.
""This is not our war and we cannot allow our youth to become human shields for others,"" he added.
On Thursday, a Kenyan national was charged over accusations he had lured young men to Russia with job opportunities, only for them to end up fighting in Ukraine. Festus Arasa Omwamba denied the charges.
A total of 1,000 Kenyans have been recruited to fight for Russia in its four-year war against Ukraine, said a report from Kenya's National Intelligence Service (NIS), released last week.
Russia's embassy in Kenya has denied accusations that it was involved in recruiting people to fight in the war.
However, it said that Russian law allowed foreign nationals who are legally in the country to voluntarily enlist in the armed forces.
On Wednesday, Ghana's foreign minister urged President Volodymyr Zelensky to release two Ghanaian prisoners of war captured fighting for Russia.
""They are victims of manipulation, of disinformation, misinformation, of criminal trafficking networks,"" he said.
He thanked Ukraine for ensuring international law was respected in the handling of the detainees.
""We have received reports that they are in good health,"" he said. ""They have not been tortured. They have not suffered any inhumane treatment since they were captured.""
The family of one of the men said they were hopeful he would be freed soon. According to the AFP news agency, 35-year-old Joshua Nkrumah left his pregnant wife in Dubai in July 2024 and travelled to Russia, believing he had secured a private security job.
He was captured by Ukrainian forces in September 2024 after surviving a drone strike. Nkrumah remains in detention, and his family has had no contact with him since.
Joshua's father, Albert, told AFP that he sometimes wondered if his son was dead or alive.
""As a father, I live every day with a silent weight on my chest. I wake up and the first thing I think about is my son - whether he has eaten, whether he is safe, whether he still has hope,"" he added.
""I just want my son alive and back home. That is all a father asks.""
Ukrainian Foreign Minister Andriy Sybiga said both sides discussed ""frankly"" about the possibility of returning the prisoners to Ghana.
South Africa on Thursday said that two of its citizens had been killed in Ukraine, while another 15 had been repatriated over the past week. Two more remain in Russia getting treatment for ""very severe"" injuries, said Foreign Minister Ronald Lamola.
Ukrainian officials have repeatedly warned that anyone fighting for Russia would be treated as an enemy combatant, and that the only safe route out was to surrender and be treated as a prisoner of war.
Ukraine has also previously come in for criticism for trying to recruit foreign nationals, including Africans, to fight on its side.
You may also be interested in:
Go to BBCAfrica.com for more news from the African continent.
Follow us on Twitter @BBCAfrica, on Facebook at BBC Africa or on Instagram at bbcafrica"
26-02-26,Russia Ukraine war,BBC,Europe,"Russia says it has handed over 1,000 Ukrainian soldiers' bodies",https://www.bbc.com/news/articles/cg7ed4rp7x5o,"Russia and Ukraine exchange more than 1,000 soldiers' bodies
Russia says it has handed over the remains of 1,000 soldiers to Ukraine and has received the bodies of 35 Russian soldiers in return.
It comes as Ukraine's chief negotiator met US President Donald Trump's envoys in Geneva to discuss economic plans for the reconstruction of Ukraine after the war.
Negotiators were also preparing a third round of US-led talks aimed at ending the conflict which has entered its fifth year - a trilateral meeting involving the Russian side, too.
Hours before the Geneva talks, Russia launched 420 drones and 39 missiles in six different regions of Ukraine, injuring dozens of people, Ukraine's President Volodymyr Zelensky said.
Vladimir Medinsky, a top aide of Russian President Vladimir Putin, announced the exchange of bodies in a short announcement on Telegram. He gave no details, but included an image showing bodies being unloaded from a truck.
Hours later, Ukraine said it had received 1,000 bodies which, ""according to prior information from the Russian side, may belong to Ukrainian defenders"".
The two sides have exchanged thousands of soldiers' bodies over the course of the conflict that began with Putin's decision to launch a full-scale invasion of Ukraine on 24 February 2022.
The exchange is based on an agreement reached by the two sides during negotiations in Istanbul in June 2025. Moscow and Kyiv agreed to return the bodies of up to 6,000 soldiers each, as well as all sick and heavily wounded prisoners of war and those aged under 25.
Kyiv and Moscow regularly publish estimates of the other side's losses, but do not detail their own.
Zelensky recently admitted 55,000 Ukrainian soldiers had been killed on the battlefield - a figure Western observers describe as an underestimate as it does not include those missing.
And from public sources, the BBC has confirmed the names of almost 186,000 people killed fighting on Russia's side in Ukraine. The true death toll is generally accepted to be much higher, as many deaths on the battlefield are not recorded.
So even though estimates suggest more Russians are dying every day, Moscow has returned more bodies to Ukraine overall than it has received.
No-one has explained the discrepancy, even though Russia has previously accused Ukraine of not abiding by the Istanbul agreement, and Ukraine has alleged Russian body returns were irregular and sometimes included Russians' remains - a charge Moscow has rejected.
One possible explanation is that Russia captures more Ukrainian bodies given its troops have been on the attack most of the time and, therefore, more able to retrieve them from the battlefield.
On the eve of the Geneva talks, President Zelensky had a telephone conversation with Trump and said he expected the Geneva meeting would lead to trilateral negotiations at the beginning of March - thus creating ""an opportunity to move talks to the leaders' level"".
""President Trump supports this sequence of steps,"" Zelensky said, adding: ""This is the only way to resolve all the complex and sensitive issues and finally end the war.""
Putin, for his part, has refused to meet Zelensky, describing him as illegitimate - an argument centring on the fact that no presidential election has been held in Ukraine, despite the expiry of Zelensky's term in March 2024.
However, Ukraine's constitution bars holding elections under martial law - imposed in the wake of Putin's invasion of his neighbour."
13-03-26,Russia Ukraine war,BBC,Europe,Ukraine and allies fear easing Russian sanctions will prolong war,https://www.bbc.com/news/articles/c1d6l67122wo,"Ukraine and allies fear easing Russian sanctions will prolong war
The decision by the US to ease some sanctions on Russian oil sales has provoked a chorus of criticism from European leaders.
President Emmanuel Macron of France said there was ""no justification"" for it. Chancellor Friedrich Merz of Germany said the decision was ""wrong"". EU Council President Antonio Costa said it was ""very concerning"".
Russia is already benefiting from rising oil prices driven by the Middle East war.
These European leaders fear that allowing Russia to sell more of its oil will give an even bigger boost to Kremlin coffers.
Russia has been under US and European sanctions since it launched its full-scale invasion of Ukraine in February 2022.
The US under President Donald Trump had also imposed sanctions on countries buying Russian oil and gas - big consumers like India.
But with world markets rattled by the US and Israeli war against Iran - and the Iranian retaliation against their allies in the Gulf, some major energy producers for world markets - Trump has decided to ease sanctions.
Late on Thursday, US Treasury Secretary Scott Bessent announced a temporary suspension of sanctions on Russian oil already on tankers at sea a temporary suspension of sanctions on Russian oil already on tankers at sea.
At a news conference in Paris, where he met his French counterpart, President Volodymyr Zelensky said this US decision alone was worth $10bn (£7.5bn) to Russia. ""This certainly does not help peace,"" he said.
That is because the more revenues Russia can earn, the more pressure it can ease on its war economy.
Such is the squeeze on Russian public finances in recent months, the Kremlin had to sell gold reserves and increase consumption taxes to boost revenues. With extra oil sales, Russia will now be able to buy more weapons and soldiers to throw into the front line.
For European leaders, this could not have come at a worse time. Ukraine has survived a brutal winter. It has started taking some territory back from Russia. It has struck targets deep inside Russian territory.
At the same time, Russia was facing economic tensions and struggling to recruit enough soldiers to replace the 1,000 or so casualties, both dead and wounded, it continues to suffer almost daily.
But now Russia is being given an economic boost and its opponents are distracted by war in the Middle East. It continues to talk to the US - there was a meeting only days ago between senior Trump and Kremlin officials in Miami, about which little is known.
In fact, Ukraine is struggling for cash because promised EU funds worth €90bn ($103bn; £77bn) are being delayed by a row with Hungary.
Kyiv is under pressure from the EU to reopen a pipeline - that passes through its territory - that was damaged by Russian strikes in January. It normally carries - extraordinarily - Russian oil to Hungary and elsewhere and Budapest accuses Kyiv of dragging its feet repairing the pipeline. The authorities in Ukraine say the damage is severe and will take time to fix.
So the war in Iran is having - perhaps inevitably - an impact far outside the Middle East.
President Trump's envoys have been leading efforts to end the war in Ukraine.
But the US president does not appear to have taken on board the views of Ukraine or its European allies with his unilateral decision to ease pressure on Russia - a move that will, inevitably, mean peace talks will be less likely to make much progress for the time being.
The fear among European chancelleries is that this could get worse and the temporary US easing of sanctions on Russia could become permanent.
A spokesman for UK Prime Minister Sir Keir Starmer said all allies should maintain pressure on Russia and its war chest. ""The best way to continue to stop Russia supporting hostile actors is to continue on collective pressure and end the war in Ukraine,"" he said.
But for now, that pressure is not collective, it is being reduced - and the Kremlin is reaping the harvest."
11-03-26,Russia Ukraine war,BBC,Europe,Ukraine says it has hit Russian 'missile component' plant,https://www.bbc.com/news/articles/ckg1eqw30l9o,"Ukraine says it has hit Russian 'missile component' plant
Ukrainian forces have struck one of Russia's ""most important military factories"", President Volodymyr Zelensky has said.
""The plant produced electronics and components for Russian missiles. The very missiles that strike our cities, our villages and civilians,"" he said.
British Storm Shadow missiles were used to hit Kremniy El plant in the border region of Bryansk, Ukraine's military said.
Russian local authorities say at least six civilians were killed and 42 injured in the ""terrorist missile attack"". President Vladimir Putin's spokesman said it was ""obvious that the launch of these missiles was impossible without British specialists"".
""In order to prevent such barbaric actions by the Kyiv regime from continuing, the special military operation is being conducted,"" Dmitry Peskov said, using the Russian description for the full-scale invasion of Ukraine that Putin ordered on 24 February 2022.
Peskov said one of the goals of the Russian operation was to demilitarise Ukraine. Putin himself has often stated that demilitarisation is a central objective of the war.
But it is due to the Russian invasion that Ukraine has been receiving Western support - including sophisticated weapons aimed at defending its territories.
Russia, for its part, has also been receiving help from its allies, including Shahed drones supplied by Iran and soldiers sent by North Korea.
One of those drones was used in an attack which killed two people and injured another five in the second-largest city of Kharkiv on Wednesday, Ukrainian officials said.
Another Russian attack a day earlier in Slovyansk, in eastern Ukraine, killed four and injured 16.
Both sides have continued attacks, even though the war has reached a stalemate recently.
Russia has been making slow advances in the battlefield, but Ukraine also says it is reclaiming more land seized by the Russians.
Zelensky says another round of talks - involving Russian and American negotiators - may be held next week.
The process is being led by US President Donald Trump, who has been trying to end the war.
The outcome of the talks hinges on part of his proposals that envisages Ukraine giving up to Russia areas it does not currently control in the Donbas - an industrial area composed of the administrative regions of Donetsk and Luhansk.
Russia currently controls more than 80% of those areas - which Ukraine says it cannot agree to relinquish."
16-03-26,Russia Ukraine war,BBC,Europe,"Russia will stop deploying Kenyan fighters to Ukraine, Musalia Mudavadi says",https://www.bbc.com/news/articles/cev7rdwmky9o,"Russia agrees to stop using Kenyan recruits in Ukraine conflict, Kenya says
Kenya's foreign minister says Russia has agreed to stop deploying Kenyan nationals to fight in the war in Ukraine, after talks in Moscow.
Sitting beside his Russian counterpart, Sergei Lavrov, Musalia Mudavadi said both sides had agreed that Kenyans would no longer be recruited through Russia's defence ministry. ""They will no longer be eligible to be enlisted,"" he said.
Lavrov did not comment on the deal and insisted that all foreign fighters had joined voluntarily ''in full compliance with Russian law''.
A Kenyan intelligence report in February warned that more than 1,000 citizens had been recruited to fight for Russia in Ukraine.
Some Kenyans have said they were lured to fight for Russia with promises of well‑paid civilian jobs, only to find themselves forced into fighting in Ukraine,
Mudavadi is also seeking the repatriation of Kenyans who wish to return home.
He last month told the BBC that Kenyan authorities had closed more than 600 recruitment agencies suspected of duping Kenyans with promises of jobs overseas.
Kenyan lawmakers say rogue state officials have been working with human trafficking networks to recruit citizens to fight for Russia in Ukraine.
So far 27 Kenyans who had been fighting in Russia have been repatriated, with authorities providing psychological care to address their trauma and ""de-radicalise"" them, Mudavadi said.
It is not clear how many Kenyans have died fighting for Russian forces, and Russia has not formally addressed such reports. Relatives who have approached the Russian embassy in Nairobi for answers report being turned away.
Public pressure has also grown. In February, families of Kenyans believed to be fighting in Ukraine held a protest outside parliament in Nairobi, calling for government action and the return of their relatives.
During his visit to Moscow, Mudavadi also intends to negotiate an agreement allowing Kenyans easier access to the Russian job market.
""We do not want for any reason our partnership with Russia to be defined from the lenses of the special operation [in Ukraine] agenda only,"" he said. ""The relationship between Kenya and Russia is much more broader than that.""
Ukrainian intelligence assessment estimates that more than 1,700 people from 36 countries in Africa have been recruited to fight for Russia.
In February, South Africa repatriated 17 citizens who said they had been trapped in Ukraine's Donbas region after being deceived into fighting for Russia.
Ukraine has also previously come in for criticism for trying to recruit foreign nationals, including Africans, to fight on its side.
Go to BBCAfrica.com for more news from the African continent.
Follow us on Twitter @BBCAfrica, on Facebook at BBC Africa or on Instagram at bbcafrica"
17-02-26,Russia Ukraine war,BBC,Europe,First day of US-brokered Russia-Ukraine peace talks ends in Geneva,https://www.bbc.com/news/articles/cge812y2549o,"First day of Russia-Ukraine peace talks ends in Geneva
Russian and Ukrainian delegations have ended the first day of US-brokered peace talks in Geneva, a week before the fourth anniversary of Moscow's full-scale invasion of Ukraine.
Top Ukrainian negotiator Rustem Umerov said the negotiations would continue in the Swiss city on Wednesday morning.
Hopes for a breakthrough during the latest - third - round of trilateral talks are low, as the Kremlin has not wavered from its maximalist demands for Ukrainian territory.
Russian strikes on Ukraine continue on a nightly basis, further damaging the country's already battered power grid as subzero temperatures continue.
Just hours before the delegations met in Geneva, Russia carried out a large combined aerial attack on Ukraine, hitting 12 regions with 400 drones and almost 30 missiles. At least three people were killed, Ukrainian officials said.
Meanwhile, Russia said its air defences had repelled more than 150 drones, while an oil refinery caught on fire after a Ukrainian drone strike.
In a statement on social media on Tuesday evening, Umerov, Ukraine's top security official, said the talks focused on ""practical issues and the mechanics of possible solutions"".
He said he would now inform Ukrainian President Volodymyr Zelensky about the results.
In his video address shortly afterwards, Zelensky said Ukraine was ready to refrain from carrying out strikes as earlier proposed by the US to both Kyiv and Moscow.
""We don't need war,"" he said, stressing that Ukrainians were ""defending our state, our independence"".
""We are also ready to quickly move towards a worthy agreement to end the war. The question is only for the Russians: what do they want?""
Meanwhile, Russia's state RIA news agency quoted a source saying that Tuesday's negotiations, which lasted six hours, had been tense and took place in different bilateral and trilateral formats.
The talks are being mediated by Steve Witkoff, Donald Trump's special envoy, and Jared Kushner, the US president's son-in-law.
On the Russian side, President Vladimir Putin's aide Vladimir Medinsky is the top negotiator.
Both Ukraine and Russia also had senior military figures in their teams.
Ahead of the talks, Trump said Ukraine had ""better come to the table fast.""
He has previously signalled his impatience with the lack of swift progress in solving the four-year conflict.
Russia occupies roughly 20% of Ukraine, including large parts of the eastern Donbas region. The Kremlin wants Ukraine to hand over the rest of the region, which Ukraine has ruled out.
For Ukraine, robust security guarantees from the West - including the US - must come before any settlement with Russia can be agreed.
In Kyiv, Ukrainian Foreign Minister Andrii Sybhiha condemned the overnight Russian strikes, saying they showed the ""extent to which Russia disregards peace efforts"".
At least three energy workers were killed near the frontline city of Slovyansk in Monday's overnight attacks, Ukraine's deputy Energy Minister Artem Nekrasov said.
A further nine people - including children - were injured across the country, President Zelensky said. More than 10 residential buildings were damaged, with railway infrastructure also damaged.
""Russia must be held to account for its aggression,"" he wrote on X, adding: ""For peace to be real and just, action must target the sole source of this aggression"".
Kyiv said 12 regions were hit, damaging infrastructure and leaving thousands without power in the southern port city of Odesa.
DTEK, the country's largest private energy firm, said power infrastructure in the city had suffered ""incredibly serious"" damage, adding it would take a long time to return to a working condition.
Ukraine is facing an acute energy crisis after months of relentless Russian attacks on its infrastructure and as it struggles through a freezing winter.
It launched its own volley of attacks on Russia overnight. Officials said a fire broke out at the Ilsky oil refinery in the southern Krasnodar region after a drone strike. A reservoir storing oil products also caught fire.
The border region of Belgorod continued to come under attack, with Ukraine launching dozens of drones and causing significant damage of power infrastructure.
These latest discussions follow last month's trilateral talks in Abu Dhabi, which were the first three-way between Russia, Ukraine and the US since Moscow launched its full-scale invasion of its neighbour in February 2022.
They ended with no breakthrough - although the first prisoner of war exchanges in months took place shortly after.
Additional reporting by Jaroslav Lukiv"
